_id,title,release_year,movie_rating,summary,Up_System
837,The Pacifier,2005,5.6,"Having recovered from wounds received in a failed rescue operation, Navy SEAL Shane Wolfe is handed a new assignment: Protect the five Plummer kids from enemies of their recently deceased father -- a government scientist whose top-secret experiment remains in the kids' house.",CM
838,Dr. Dolittle 2,2001,4.7,Dolittle must save a forest and a bear's life.,CM
839,It's Complicated,2009,6.6,"When attending their son's college graduation, a couple reignite the spark in their relationship. But the complicated fact is they're divorced and he's remarried.",CM
840,Spy Kids,2001,5.5,The children of secret-agent parents must save them from danger.,CM
841,Ghostbusters II,1989,6.5,The discovery of a massive river of ectoplasm and a resurgence of spectral activity allows the staff of Ghostbusters to revive the business.,CM
842,Face/Off,1997,7.3,"In order to foil an extortion plot, an FBI agent undergoes a facial transplant surgery and assumes the identity and physical appearance of a terrorist, but the plan turns from bad to worse when the same terrorist impersonates the FBI agent.",CM
843,The Hangover Part III,2013,5.8,"When one of their own is kidnapped by an angry gangster, the Wolf Pack must track down Mr. Chow, who has escaped from prison and is on the run.",CM
844,One Flew Over the Cuckoo's Nest,1975,8.7,A criminal pleads insanity after getting into trouble again and once in the mental institution rebels against the oppressive nurse and rallies up the scared patients.,CM
845,Twins,1988,6.0,"A physically perfect but innocent man goes in search of his long-lost twin brother, who is short, a womanizer, and small-time crook.",CM
846,Spy Kids 3-D: Game Over,2003,4.2,"Carmen's caught in a virtual reality game designed by the Kids' new nemesis, the Toymaker. It's up to Juni to save his sister, and ultimately the world.",CM
847,Doctor Zhivago,1965,8.0,"The life of a Russian physician and poet who, although married to another, falls in love with a political activist's wife and experiences hardship during World War I and then the October Revolution.",CM
848,Enemy of the State,1998,7.3,A lawyer becomes a target by a corrupt politician and his N.S.A. goons when he accidentally receives key evidence to a serious politically motivated crime.,CM
849,The Little Mermaid,1989,7.6,A mermaid princess makes a Faustian bargain with an unscrupulous sea-witch in order to meet a human prince on land.,CM
850,Mr. Peabody &amp; Sherman,2014,6.8,"The time-travelling adventures of an advanced canine and his adopted son, as they endeavor to fix a time rift they created.",CM
851,Porky's,1981,6.2,"In 1954, a group of Florida high school students try to help their buddy lose his virginity, which leads them to seeking revenge on a sleazy nightclub owner and his redneck sheriff brother for harassing them.",CM
852,The Last Samurai,2003,7.7,An American military advisor embraces the Samurai culture he was hired to destroy after he is captured in battle.,CM
853,Glass,2019,6.9,"Security guard David Dunn uses his supernatural abilities to track Kevin Wendell Crumb, a disturbed man who has twenty-four personalities.",CM
854,Spy,2015,7.0,"A desk-bound CIA analyst volunteers to go undercover to infiltrate the world of a deadly arms dealer, and prevent diabolical global disaster.",CM
855,Tropic Thunder,2008,7.0,"Through a series of freak occurrences, a group of actors shooting a big-budget war movie are forced to become the soldiers they are portraying.",CM
856,Valentine's Day,2010,5.7,Intertwining couples and singles in Los Angeles break-up and make-up based on the pressures and expectations of Valentine's Day.,CM
857,The Grudge,2004,5.9,"An American nurse living and working in Tokyo is exposed to a mysterious supernatural curse, one that locks a person in a powerful rage before claiming their life and spreading to another victim.",CM
858,Fun with Dick and Jane,2005,6.1,"When an affluent couple lose all their money following a series of blunders, they turn to a life of crime to make ends meet.",CM
859,Freaky Friday,2003,6.2,"An overworked mother and her daughter do not get along. When they switch bodies, each is forced to adapt to the other's life for one freaky Friday.",CM
860,Trainwreck,2015,6.2,"Having thought that monogamy was never possible, a commitment-phobic career woman may have to face her fears when she meets a good guy.",CM
861,Bedtime Stories,2008,6.1,A hotel handyman's life changes when the lavish bedtime stories he tells his niece and nephew start to magically come true.,CM
862,Scary Movie 3,2003,5.5,"Cindy must investigate mysterious crop circles and video tapes, and help the President in preventing an alien invasion.",CM
863,Creed,2015,7.6,"The former World Heavyweight Champion Rocky Balboa serves as a trainer and mentor to Adonis Johnson, the son of his late friend and former rival Apollo Creed.",CM
864,Star Trek IV: The Voyage Home,1986,7.3,"To save Earth from an alien probe, Admiral James T. Kirk and his fugitive crew go back in time to San Francisco in 1986 to retrieve the only beings who can communicate with it: humpback whales.",CM
865,The 40 Year Old Virgin,2005,7.1,"Goaded by his buddies, a nerdy guy who's never ""done the deed"" only finds the pressure mounting when he meets a single mother.",CM
866,Crocodile Dundee II,1988,5.6,Australian outback expert protects his New York love from gangsters who've followed her down under.,CM
867,Couples Retreat,2009,5.5,"A comedy centered around four couples who settle into a tropical-island resort for a vacation. While one of the couples is there to work on the marriage, the others fail to realize that participation in the resort's therapy sessions is not optional.",CM
868,A Time to Kill,1996,7.4,"In Canton, Mississippi, a fearless young lawyer and his assistant defend a black man accused of murdering two white men who raped his ten-year-old daughter, inciting violent retribution and revenge from the Ku Klux Klan.",CM
869,Black Hawk Down,2001,7.7,160 elite U.S. soldiers drop into Somalia to capture two top lieutenants of a renegade warlord and find themselves in a desperate battle with a large force of heavily-armed Somalis.,CM
870,Terms of Endearment,1983,7.4,"Follows hard-to-please Aurora looking for love, and her daughter's family problems.",CM
871,Ace Ventura: When Nature Calls,1995,6.4,"Ace Ventura, Pet Detective, returns from a spiritual quest to investigate the disappearance of a rare white bat, the sacred animal of a tribe in Africa.",CM
872,The Princess Diaries,2001,6.3,"Mia Thermopolis has just found out that she is the heir apparent to the throne of Genovia. With her friends Lilly and Michael Moscovitz in tow, she tries to navigate through the rest of her sixteenth year.",CM
873,Superman II,1980,6.8,"Superman agrees to sacrifice his powers to start a relationship with Lois Lane, unaware that three Kryptonian criminals he inadvertently released are conquering Earth.",CM
874,Hop,2011,5.4,"E.B., the Easter Bunny's teenage son, heads to Hollywood, determined to become a drummer in a rock 'n' roll band. In LA, he's taken in by Fred after the out-of-work slacker hits E.B. with his car.",CM
875,Pulp Fiction,1994,8.9,"The lives of two mob hitmen, a boxer, a gangster's wife, and a pair of diner bandits intertwine in four tales of violence and redemption.",CM
876,Paranormal Activity,2007,6.3,"After moving into a suburban home, a couple becomes increasingly disturbed by a nightly demonic presence.",CM
877,Baby Driver,2017,7.6,"After being coerced into working for a crime boss, a young getaway driver finds himself taking part in a heist doomed to fail.",CM
878,The Upside,2017,6.4,A comedic look at the relationship between a wealthy man with quadriplegia and an unemployed man with a criminal record who's hired to help him.,CM
879,A League of Their Own,1992,7.2,Two sisters join the first female professional baseball league and struggle to help it succeed amidst their own growing rivalry.,CM
880,Epic,2013,6.7,A teenager finds herself transported to a deep forest setting where a battle between the forces of good and the forces of evil is taking place. She bands together with a rag-tag group of characters in order to save their world -- and ours.,CM
881,Watchmen,2009,7.6,"In 1985 where former superheroes exist, the murder of a colleague sends active vigilante Rorschach into his own sprawling investigation, uncovering something that could completely change the course of history as we know it.",CM
882,The Angry Birds Movie,2016,6.3,"Find out why the birds are so angry. When an island populated by happy, flightless birds is visited by mysterious green piggies, it's up to three unlikely outcasts - Red, Chuck and Bomb - to figure out what the pigs are up to.",CM
883,Batman &amp; Robin,1997,3.7,Batman and Robin try to keep their relationship together even as they must stop Mr. Freeze and Poison Ivy from freezing Gotham City.,CM
884,Captain Phillips,2013,7.8,"The true story of Captain Richard Phillips and the 2009 hijacking by Somali pirates of the U.S.-flagged MV Maersk Alabama, the first American cargo ship to be hijacked in two hundred years.",CM
885,Black Swan,2010,8.0,"A committed dancer struggles to maintain her sanity after winning the lead role in a production of Tchaikovsky's ""Swan Lake"".",CM
886,Analyze This,1999,6.7,A comedy about a psychiatrist whose number one patient is an insecure mob boss.,CM
887,Chicken Run,2000,7.0,"When a cockerel apparently flies into a chicken farm, the chickens see him as an opportunity to escape their evil owners.",CM
888,Miss Congeniality,2000,6.2,An F.B.I. Agent must go undercover in the Miss United States beauty pageant to prevent a group from bombing the event.,CM
889,Indecent Proposal,1993,5.9,A billionaire offers one million dollars to a young married couple for one night with the wife.,CM
890,GoldenEye,1995,7.2,James Bond teams up with the lone survivor of a destroyed Russian research center to stop the hijacking of a nuclear space weapon by a fellow Agent formerly believed to be dead.,CM
891,Driving Miss Daisy,1989,7.4,An old Jewish woman and her African-American chauffeur in the American South have a relationship that grows and improves over the years.,CM
892,300: Rise of an Empire,2014,6.2,"Greek general Themistokles leads the charge against invading Persian forces led by mortal-turned-god Xerxes and Artemisia, vengeful commander of the Persian navy.",CM
893,Love Story,1970,6.9,A boy and a girl from different backgrounds fall in love regardless of their upbringing - and then tragedy strikes.,CM
894,Kramer vs. Kramer,1979,7.8,"Ted Kramer's wife leaves him, allowing for a lost bond to be rediscovered between Ted and his son, Billy. But a heated custody battle ensues over the divorced couple's son, deepening the wounds left by the separation.",CM
895,The Italian Job,2003,7.0,"After being betrayed and left for dead in Italy, Charlie Croker and his team plan an elaborate gold heist against their former ally.",CM
896,Every Which Way but Loose,1978,6.3,The San Fernando Valley adventures of trucker turned prize-fighter Philo Beddoe and his pet orangutan Clyde.,CM
897,How to Lose a Guy in 10 Days,2003,6.4,"Benjamin Barry is an advertising executive and ladies' man who, to win a big campaign, bets that he can make a woman fall in love with him in 10 days. Andie Anderson covers the ""How To"" beat for ""Composure"" magazine and is assigned to write an article on ""How to Lose a Guy in 10 days."" They meet in a bar shortly after the bet is made.",CM
898,The First Wives Club,1996,6.3,"Reunited by the death of a college friend, three divorced women seek revenge on the husbands who left them for younger women.",CM
899,Robin Hood,2010,6.7,"In 12th century England, Robin and his band of marauders confront corruption in a local village and lead an uprising against the crown that will forever alter the balance of world power.",CM
900,Interview with the Vampire: The Vampire Chronicles,1994,7.6,"A vampire tells his epic life story: love, betrayal, loneliness, and hunger.",CM
901,George of the Jungle,1997,5.5,A man raised in the jungle by apes falls in love with a wealthy American heiress.,CM
902,The Graduate,1967,8.0,A disillusioned college graduate finds himself torn between his older lover and her daughter.,CM
903,Pitch Perfect 3,2017,5.8,"Following their win at the world championship, the now separated Bellas reunite for one last singing competition at an overseas USO tour, but face a group who uses both instruments and voices.",CM
904,The Lego Movie 2: The Second Part,2019,6.9,"It's been five years since everything was awesome and the citizens are facing a huge new threat: Lego Duplo invaders from outer space, wrecking everything faster than they can rebuild.",CM
905,Phenomenon,1996,6.4,"An ordinary man sees a bright light descend from the sky, and discovers he now has super-intelligence and telekinesis.",CM
906,American Wedding,2003,6.3,"It's the wedding of Jim and Michelle and the gathering of their families and friends, including Jim's old friends from high school and Michelle's little sister.",CM
907,Road to Perdition,2002,7.7,"A mob enforcer's son witnesses a murder, forcing him and his father to take to the road, and his father down a path of redemption and revenge.",CM
908,The Princess and the Frog,2009,7.1,"A waitress, desperate to fulfill her dreams as a restaurant owner, is set on a journey to turn a frog prince back into a human being, but she has to face the same problem after she kisses him.",CM
909,The Chronicles of Narnia: The Voyage of the Dawn Treader,2010,6.3,"Lucy and Edmund Pevensie return to Narnia with their cousin Eustace where they meet up with Prince Caspian for a trip across the sea aboard the royal ship The Dawn Treader. Along the way they encounter dragons, dwarves, merfolk, and a band of lost warriors before reaching the edge of the world.",CM
910,Daddy Day Care,2003,5.6,Two men get laid off and have to become stay-at-home dads when they can't find jobs. This inspires them to open their own day-care center.,CM
911,Daddy's Home Two,2017,6.0,"Having finally gotten used to each other's existence, Brad and Dusty must now deal with their intrusive fathers during the holidays.",CM
912,Paranormal Activity 3,2011,5.8,"In 1988, young sisters Katie and Kristi befriend an invisible entity who resides in their home.",CM
913,Journey 2: The Mysterious Island,2012,5.8,"Sean Anderson partners with his mom's husband on a mission to find his grandfather, who is thought to be missing on a mythical island.",CM
914,The Mule,2018,7.1,A 90-year-old horticulturist and Korean War veteran turns drug mule for a Mexican cartel.,CM
915,Dick Tracy,1990,6.1,The comic strip detective finds his life vastly complicated when Breathless Mahoney makes advances towards him while he is trying to battle Big Boy Caprice's united mob.,CM
916,Rise of the Guardians,2012,7.3,"When the evil spirit Pitch launches an assault on Earth, the Immortal Guardians team up to protect the innocence of children all around the world.",CM
917,Dreamgirls,2006,6.5,"A trio of black female soul singers cross over to the pop charts in the early 1960s, facing their own personal struggles along the way.",CM
918,9 to 5,1980,6.8,"Three female employees of a sexist, egotistical, lying, hypocritical bigot find a way to turn the tables on him.",CM
919,Independence Day: Resurgence,2016,5.2,"Two decades after the first Independence Day invasion, Earth is faced with a new extra-Solar threat. But will mankind's new space defenses be enough?",CM
920,The Expendables,2010,6.5,A CIA operative hires a team of mercenaries to eliminate a Latin dictator and a renegade CIA agent.,CM
921,Scream,1996,7.2,"A year after the murder of her mother, a teenage girl is terrorized by a new killer, who targets the girl and her friends by using horror films as part of a deadly game.",CM
922,Just Go with It,2011,6.4,"On a weekend trip to Hawaii, a plastic surgeon convinces his loyal assistant to pose as his soon-to-be-divorced wife in order to cover up a careless lie he told to his much-younger girlfriend.",CM
923,Jaws 2,1978,5.7,Police chief Brody must protect the citizens of Amity after a second monstrous shark begins terrorizing the waters.,CM
924,Murder on the Orient Express,2017,6.5,"When a murder occurs on the train on which he's travelling, celebrated detective Hercule Poirot is recruited to solve the case.",CM
925,Bambi,1942,7.3,The story of a young deer growing up in the forest.,CM
926,The General's Daughter,1999,6.3,"When the daughter of a well-known and well-respected base commander is murdered, an undercover detective is summoned to look into the matter and finds a slew of cover-ups at West Point.",CM
927,The Aviator,2004,7.5,A biopic depicting the early years of legendary Director and aviator Howard Hughes' career from the late 1920s to the mid 1940s.,CM
928,American Pie,1999,7.0,Four teenage boys enter a pact to lose their virginity by prom night.,CM
929,Daredevil,2003,5.3,A man blinded by toxic waste which also enhanced his remaining senses fights crime as an acrobatic martial arts superhero.,CM
930,The Girl with the Dragon Tattoo,2011,7.8,"Journalist Mikael Blomkvist is aided in his search for a woman who has been missing for forty years by Lisbeth Salander, a young computer hacker.",CM
931,The Mummy: Tomb of the Dragon Emperor,2008,5.2,"In the Far East, Alex O'Connell, the son of famed mummy fighters Rick and Evy O'Connell, unearths the mummy of the first Emperor of Qin -- a shape-shifting entity cursed by a witch centuries ago.",CM
932,The Conjuring 2,2016,7.4,Ed and Lorraine Warren travel to North London to help a single mother raising 4 children alone in a house plagued by a supernatural spirit.,CM
933,The Maze Runner,2014,6.8,"Thomas is deposited in a community of boys after his memory is erased, soon learning they're all trapped in a maze that will require him to join forces with fellow ""runners"" for a shot at escape.",CM
934,In the Line of Fire,1993,7.2,"Secret Service agent Frank Horrigan couldn't save Kennedy, but he's determined not to let a clever assassin take out this president.",CM
935,Butch Cassidy and the Sundance Kid,1969,8.1,"Wyoming, early 1900s. Butch Cassidy and The Sundance Kid are the leaders of a band of outlaws. After a train robbery goes wrong they find themselves on the run with a posse hard on their heels. Their solution - escape to Bolivia.",CM
936,Mary Poppins,1964,7.8,"In turn of the century London, a magical nanny employs music and adventure to help two neglected children become closer to their father.",CM
937,Annabelle: Creation,2017,6.5,"Twelve years after the tragic death of their little girl, a doll-maker and his wife welcome a nun and several girls from a shuttered orphanage into their home, where they become the target of the doll-maker's possessed creation, Annabelle.",CM
938,The Equalizer 2,2018,6.7,"Robert McCall serves an unflinching justice for the exploited and oppressed, but how far will he go when that is someone he loves?",CM
939,Bad Grandpa,2013,6.5,"86-year-old Irving Zisman takes a trip from Nebraska to North Carolina to take his 8 year-old grandson, Billy, back to his real father.",CM
940,The Goodbye Girl,1977,7.4,"After being dumped by her live-in boyfriend, an unemployed dancer and her 10-year-old daughter are reluctantly forced to live with a struggling off-Broadway actor.",CM
941,Pacific Rim,2013,6.9,"As a war between humankind and monstrous sea creatures wages on, a former pilot and a trainee are paired up to drive a seemingly obsolete special weapon in a desperate effort to save the world from the apocalypse.",CM
942,Journey to the Center of the Earth,2008,5.8,"On a quest to find out what happened to his missing brother, a scientist, his nephew and their mountain guide discover a fantastic and dangerous lost world in the center of the earth.",CM
943,Gone in 60 Seconds,2000,6.5,A retired master car thief must come back to the industry and steal fifty cars with his crew in one night to save his brother's life.,CM
944,Maverick,1994,7.0,"Bret Maverick, needing money for a poker tournament, faces various comic mishaps and challenges, including a charming woman thief.",CM
945,Sleeping with the Enemy,1991,6.2,"A young woman fakes her own death in an attempt to escape her nightmarish marriage, but discovers it is impossible to elude her controlling husband.",CM
946,The Equalizer,2014,7.2,"A man believes he has put his mysterious past behind him and has dedicated himself to beginning a new, quiet life. But when he meets a young girl under the control of ultra-violent Russian gangsters, he can't stand idly by - he has to help her.",CM
947,This Is the End,2013,6.6,"6 Los Angeles celebrities are stuck in James Franco's house after a series of devastating events just destroyed the city. Inside, the group not only will have to face with the apocalypse, but with themselves.",CM
948,Scream 2,1997,6.1,"Two years after the first series of murders, as Sydney acclimates to college life, someone donning the Ghostface costume begins a new string of killings.",CM
949,Stir Crazy,1980,6.8,"Set up and wrongfully accused, two best friends will be sent to prison for a crime they didn't commit. However, no prison cell could keep them locked in.",CM
950,Eraser,1996,6.1,A Witness Protection specialist becomes suspicious of his co-workers when dealing with a case involving high-tech weapons.,CM
951,The Prince of Egypt,1998,7.1,An Egyptian prince learns of his identity as a Hebrew and his destiny to become the chosen deliverer of his people.,CM
952,Noah,2014,5.8,Noah is chosen by God to undertake a momentous mission before an apocalyptic flood cleanses the world.,CM
953,Unforgiven,1992,8.2,"Retired Old West gunslinger William Munny reluctantly takes on one last job, with the help of his old partner and a young man.",CM
954,The Cat in the Hat,2003,3.9,Two bored children have their lives turned upside down when a talking cat comes to visit them.,CM
955,Con Air,1997,6.8,Newly paroled ex-con and former U.S. Ranger Cameron Poe finds himself trapped in a prisoner transport plane when the passengers seize control.,CM
956,Eagle Eye,2008,6.6,"Jerry and Rachel are two strangers thrown together by a mysterious phone call from a woman they have never met. Threatening their lives and family, she pushes Jerry and Rachel into a series of increasingly dangerous situations, using the technology of everyday life to track and control their every move.",CM
957,Sleepy Hollow,1999,7.4,"Ichabod Crane is sent to Sleepy Hollow to investigate the decapitations of three people, with the culprit being the legendary apparition, The Headless Horseman.",CM
958,Collateral,2004,7.5,A cab driver finds himself the hostage of an engaging contract killer as he makes his rounds from hit to hit during one night in Los Angeles.,CM
959,Contact,1997,7.4,"Dr. Ellie Arroway, after years of searching, finds conclusive radio proof of extraterrestrial intelligence, sending plans for a mysterious machine.",CM
960,Charlie's Angels: Full Throttle,2003,4.9,The Angels investigate a series of murders which occur after the theft of a witness protection profile database.,CM
961,The Pelican Brief,1993,6.6,"A law student uncovers a conspiracy, putting herself and others in danger.",CM
962,Vanilla Sky,2001,6.9,A self-indulgent and vain publishing magnate finds his privileged life upended after a vehicular accident with a resentful lover.,CM
963,Arrival,2016,7.9,A linguist works with the military to communicate with alien lifeforms after twelve mysterious spacecraft appear around the world.,CM
964,Due Date,2010,6.5,High-strung father-to-be Peter Highman is forced to hitch a ride with aspiring actor Ethan Tremblay on a road trip in order to make it to his child's birth on time.,CM
965,The Rugrats Movie,1998,5.9,"Tommy, Chuckie, Phil, Lil and newborn baby Dil get lost in the forest.",CM
966,Million Dollar Baby,2004,8.1,A determined woman works with a hardened boxing trainer to become a professional.,CM
967,Airport,1970,6.6,"A bomber on board an airplane, an airport almost closed by snow, and various personal problems of the people involved.",CM
968,A Wrinkle in Time,2018,4.2,"After the disappearance of her scientist father, three peculiar beings send Meg, her brother, and her friend to space in order to find him.",CM
969,Jumanji,1995,7.0,"When two kids find and play a magical board game, they release a man trapped for decades in it and a host of dangers that can only be stopped by finishing the game.",CM
970,Step Brothers,2008,6.9,Two aimless middle-aged losers still living at home are forced against their will to become roommates when their parents marry.,CM
971,Evan Almighty,2007,5.4,God contacts Congressman Evan Baxter and tells him to build an ark in preparation for a great flood.,CM
972,Fifty Shades Freed,2018,4.5,"Anastasia and Christian get married, but Jack Hyde continues to threaten their relationship.",CM
973,Casper,1995,6.1,A paranormal expert and his daughter bunk in an abandoned house populated by three mischievous ghosts and one friendly one.,CM
974,Shakespeare in Love,1998,7.1,"A young Shakespeare, out of ideas and short of cash, meets his ideal woman and is inspired to write one of his most famous plays.",CM
975,Bad Teacher,2011,5.7,"A lazy, incompetent middle school teacher who hates her job, her students, and her co-workers is forced to return to teaching to make enough money for breast implants after her wealthy fianc dumps her.",CM
976,Yogi Bear,2010,4.6,"A documentary filmmaker travels to Jellystone Park to shoot a project and soon crosses paths with Yogi Bear, his sidekick Boo-Boo and Ranger Smith.",CM
977,Cowboys &amp; Aliens,2011,6.0,"A spaceship arrives in Arizona, 1873, to take over the Earth, starting with the Wild West region. A posse of cowboys and natives are all that stand in their way.",CM
