_id,title,release_year,movie_rating,summary,Up_System
1664,Road Trip,2000,6.5,Four college buddies embark on a road trip to retrieve an illicit tape mistakenly mailed to a female friend.,CM
1665,Blue Streak,1999,6.3,A former convict poses as a cop to retrieve a diamond he stole years ago.,CM
1666,Purple Rain,1984,6.5,"A young musician, tormented by an abusive situation at home, must contend with a rival singer, a burgeoning romance, and his own dissatisfied band, as his star begins to rise.",CM
1667,Bring It On,2000,6.0,A champion high school cheerleading squad discovers its previous captain stole all their best routines from an inner-city school and must scramble to compete at this year's championships.,CM
1668,Obsessed,2009,4.9,"A successful asset manager, who has just received a huge promotion, is blissfully happy in his career and in his marriage. But when a temp worker starts stalking him, all the things he's worked so hard for are placed in jeopardy.",CM
1669,Mr. Popper's Penguins,2011,6.0,"The life of a businessman begins to change after he inherits six penguins, and as he transforms his apartment into a winter wonderland, his professional side starts to unravel.",CM
1670,Octopussy,1983,6.6,"A fake Faberg egg, and a fellow Agent's death, lead James Bond to uncover an international jewel-smuggling operation, headed by the mysterious Octopussy, being used to disguise a nuclear attack on N.A.T.O. forces.",CM
1671,Outbreak,1995,6.6,Army doctors struggle to find a cure for a deadly virus spreading throughout a California town that was brought to America by an African monkey.,CM
1672,Skyscraper,2018,5.8,"A security expert must infiltrate a burning skyscraper, 225 stories above ground, when his family is trapped inside by criminals.",CM
1673,War Room,2015,6.5,"A seemingly perfect family looks to fix their problems with the help of Miss Clara, an older, wiser woman.",CM
1674,Sudden Impact,1983,6.6,"A rape victim is exacting revenge on her aggressors in a small town outside San Francisco. ""Dirty"" Harry Callahan, on suspension for angering his superiors (again), is assigned to the case.",CM
1675,A Perfect Murder,1998,6.5,"A wealthy Wall Street speculator discovers that his wife has a lover. He investigates him and uses the carrot and stick to make him murder his wife. Planned to detail, it seems like a perfect murder.",CM
1676,The Tourist,2010,6.0,"Revolves around Frank, an American tourist visiting Italy to mend a broken heart. Elise is an extraordinary woman who deliberately crosses his path.",CM
1677,This Is 40,2012,6.2,"Pete and Debbie are both about to turn 40, their kids hate each other, both of their businesses are failing, they're on the verge of losing their house, and their relationship is threatening to fall apart.",CM
1678,Heat,1995,8.2,A group of professional bank robbers start to feel the heat from police when they unknowingly leave a clue at their latest heist.,CM
1679,Holes,2003,7.0,A wrongfully convicted boy is sent to a brutal desert detention camp where he joins the job of digging holes for some mysterious reason.,CM
1680,Instant Family,2018,7.4,A couple find themselves in over their heads when they foster three children.,CM
1681,Insomnia,2002,7.2,Two Los Angeles homicide detectives are dispatched to a northern town where the sun doesn't set to investigate the methodical murder of a local teen.,CM
1682,A Good Day to Die Hard,2013,5.3,"John McClane travels to Russia to help out his seemingly wayward son, Jack, only to discover that Jack is a CIA operative working undercover, causing the father and son to team up against underworld forces.",CM
1683,Insidious: The Last Key,2018,5.7,"Parapsychologist Dr. Elise Rainier faces her most fearsome and personal haunting yet, as she is drawn back to her ghostly childhood home, where the terror began.",CM
1684,Role Models,2008,6.8,Wild behavior forces a pair of energy drink reps to enroll in a Big Brother program.,CM
1685,Hidalgo,2004,6.7,"In 1890, a down-and-out cowboy and his horse travel to Arabia to compete in a deadly cross desert horse race.",CM
1686,Lights Out,2016,6.3,"Rebecca must unlock the terror behind her little brother's experiences that once tested her sanity, bringing her face to face with a supernatural spirit attached to their mother.",CM
1687,Coach Carter,2005,7.3,Controversy surrounds high school basketball coach Ken Carter after he benches his entire team for breaking their academic contract with him.,CM
1688,Hacksaw Ridge,2016,8.1,"World War II American Army Medic Desmond T. Doss, who served during the Battle of Okinawa, refuses to kill people, and becomes the first man in American history to receive the Medal of Honor without firing a shot.",CM
1689,Coal Miner's Daughter,1980,7.5,"Biographical story of Loretta Lynn, a legendary country singer that came from poverty to worldwide fame. She rose from humble beginnings in Kentucky to superstardom and changing the sound and style of country music forever.",CM
1690,Race to Witch Mountain,2009,5.7,A Las Vegas cabbie enlists the help of a UFO expert to protect two siblings with paranormal powers from the clutches of an organization that wants to use the kids for their nefarious plans.,CM
1691,Dante's Peak,1997,5.9,"A vulcanologist arrives at a countryside town recently named the second most desirable place to live in America, and discovers that the long dormant volcano, Dante's Peak, may wake up at any moment.",CM
1692,The Bounty Hunter,2010,5.6,"A bounty hunter learns that his next target is his ex-wife, a reporter working on a murder cover-up. Soon after their reunion, the always-at-odds duo find themselves on a run-for-their-lives adventure.",CM
1693,Waiting to Exhale,1995,5.8,"Based on Terry McMillan's novel, this film follows four very different African-American women and their relationships with the male gender.",CM
1694,The Secret of My Success,1987,6.5,"A talented young man can't get an executive position without rising through the ranks, so he comes up with a shortcut, which also benefits his love life.",CM
1695,102 Dalmatians,2000,4.9,Cruella DeVil gets out of prison and goes after the puppies once more.,CM
1696,"Alexander and the Terrible, Horrible, No Good, Very Bad Day",2014,6.2,"Alexander's day begins with gum stuck in his hair, followed by more calamities. However, he finds little sympathy from his family and begins to wonder if bad things only happen to him, his mom, dad, brother and sister - who all find themselves living through their own terrible, horrible, no good, very bad day.",CM
1697,Kangaroo Jack,2003,4.4,"Two childhood friends, a New York hairstylist and a would-be musician, get caught up with the mob and are forced to deliver $50,000 to Australia, but things go haywire when the money is lost to a wild kangaroo.",CM
1698,End of Days,1999,5.7,"At the end of the century, Satan visits New York in search of a bride. It's up to an ex-cop who now runs an elite security outfit to stop him.",CM
1699,Changing Lanes,2002,6.5,"The story of what happens one day in New York City, when a young lawyer and a businessman share a small automobile accident on F.D.R. Drive, and their mutual road rage escalates into a feud.",CM
1700,The Mexican,2001,6.1,"A man tries to transport an ancient gun called The Mexican, believed to carry a curse, back across the border, while his girlfriend pressures him to give up his criminal ways.",CM
1701,Uncle Buck,1989,7.0,"Bachelor and all round slob, Buck, babysits his brother's rebellious teenage daughter and her cute younger brother and sister.",CM
1702,The Godfather: Part III,1990,7.6,"In the midst of trying to legitimize his business dealings in New York City and Italy in 1979, aging Mafia Don Michael Corleone seeks to avow for his sins, while taking his nephew Vincent Mancini under his wing.",CM
1703,Charlie Wilson's War,2007,7.1,"A drama based on a Texas congressman Charlie Wilson's covert dealings in Afghanistan, where his efforts to assist rebels in their war with the Soviets have some unforeseen and long-reaching effects.",CM
1704,The Forgotten,2004,5.8,"After being told that their children never existed, a man and woman soon discover there is a much bigger enemy at work.",CM
1705,Legends of the Fall,1994,7.5,"In the early 1900s, three brothers and their father living in the remote wilderness of Montana are affected by betrayal, history, love, nature, and war.",CM
1706,Babe,1995,6.8,"Babe, a pig raised by sheepdogs, learns to herd sheep with a little help from Farmer Hoggett.",CM
1707,Contraband,2012,6.5,"To protect his brother-in-law from a drug lord, a former smuggler heads to Panama to score millions of dollars in counterfeit bills.",CM
1708,The Bone Collector,1999,6.7,A quadriplegic ex-homicide detective and his female partner try to track down a serial killer who is terrorizing New York City.,CM
1709,Looper,2012,7.4,"In 2074, when the mob wants to get rid of someone, the target is sent into the past, where a hired gun awaits - someone like Joe - who one day learns the mob wants to 'close the loop' by sending back Joe's future self for assassination.",CM
1710,The Final Destination,2009,5.2,"After a young man's premonition of a deadly race-car crash helps saves the lives of his peers, Death sets out to collect those who evaded their end.",CM
1711,The League of Extraordinary Gentlemen,2003,5.8,"In an alternate Victorian Age world, a group of famous contemporary fantasy, science fiction, and adventure characters team up on a secret mission.",CM
1712,Finding Forrester,2000,7.3,A young writing prodigy finds a mentor in a reclusive author.,CM
1713,Bowfinger,1999,6.4,"When a desperate movie producer fails to get a major star for his bargain basement film, he decides to shoot the film secretly around him.",CM
1714,Warm Bodies,2013,6.9,"After a highly unusual zombie saves a still-living girl from an attack, the two form a relationship that sets in motion events that might transform the entire lifeless world.",CM
1715,The Parent Trap,1998,6.5,"Identical twins Annie and Hallie, separated at birth and each raised by one of their biological parents, later discover each other for the first time at summer camp and make a plan to bring their wayward parents back together.",CM
1716,Big Fish,2003,8.0,A frustrated son tries to determine the fact from fiction in his dying father's life.,CM
1717,Kill Bill: Vol. 2,2004,8.0,"The Bride continues her quest of vengeance against her former boss and lover Bill, the reclusive bouncer Budd, and the treacherous, one-eyed Elle.",CM
1718,Allegiant,2016,5.7,"After the earth-shattering revelations of Insurgent, Tris must escape with Four beyond the wall that encircles Chicago, to finally discover the shocking truth of the world around them.",CM
1719,Smokey and the Bandit II,1980,5.2,"The Bandit goes on another cross-country run, transporting an elephant from Florida to Texas. And, once again, Sheriff Buford T. Justice is on his tail.",CM
1720,Herbie Fully Loaded,2005,4.8,"Maggie Peyton, the new owner of Herbie, Number 53, the free-wheelin' Volkswagen bug with a mind of its own, puts the car through its paces on the road to becoming a NASCAR competitor.",CM
1721,Magic Mike XXL,2015,5.6,"Three years after Mike bowed out of the stripper life at the top of his game, he and the remaining Kings of Tampa hit the road to Myrtle Beach to put on one last blow-out performance.",CM
1722,The Manchurian Candidate,2004,6.6,"In the midst of the Gulf War, soldiers are kidnapped and brainwashed for sinister purposes.",CM
1723,Anaconda,1997,4.7,"A ""National Geographic"" film crew is taken hostage by an insane hunter, who forces them along on his quest to capture the world's largest - and deadliest - snake.",CM
1724,Bad Boys,1995,6.9,Two hip detectives protect a witness to a murder while investigating a case of stolen heroin from the evidence storage room from their police precinct.,CM
1725,Ever After: A Cinderella Story,1998,7.0,"The Brothers Grimm arrive at the home of a wealthy Grande Dame who speaks of the many legends surrounding the fable of the cinder girl before telling the ""true"" story of her ancestor.",CM
1726,Stakeout,1987,6.6,"Two detectives observe an escaped convict's ex-girlfriend, but complications set in when one of them falls for her.",CM
1727,Lara Croft Tomb Raider: The Cradle of Life,2003,5.5,"Adventurer Lara Croft goes on a quest to save the mythical Pandora's Box, before an evil scientist finds it, and recruits a former Marine turned mercenary to assist her.",CM
1728,Madea's Witness Protection,2012,5.0,A Wall Street investment banker who has been set up as the linchpin of his company's mob-backed Ponzi scheme is relocated with his family to Aunt Madea's southern home.,CM
1729,Deuce Bigalow: Male Gigolo,1999,5.7,"An average aquarium cleaner house-sits for a gigolo, only to be forced to become one himself.",CM
1730,The Taking of Pelham 123,2009,6.4,"Armed men hijack a New York City subway train, holding the passengers hostage in return for a ransom, and turning an ordinary day's work for dispatcher Walter Garber into a face-off with the mastermind behind the crime.",CM
1731,Battleship,2012,5.8,A fleet of ships is forced to do battle with an armada of unknown origins in order to discover and thwart their destructive goals.,CM
1732,Step Up,2006,6.5,"Tyler Gage receives the opportunity of a lifetime after vandalizing a performing arts school, gaining him the chance to earn a scholarship and dance with an up and coming dancer, Nora.",CM
1733,The Amityville Horror,2005,6.0,Newlyweds are terrorized by demonic forces after moving into a large house that was the site of a grisly mass murder a year before.,CM
1734,Lethal Weapon,1987,7.6,Two newly paired cops who are complete opposites must put aside their differences in order to catch a gang of drug smugglers.,CM
1735,The Visit,2015,6.2,Two siblings become increasingly frightened by their grandparents' disturbing behavior while visiting them on vacation.,CM
1736,Jack the Giant Slayer,2013,6.3,"The ancient war between humans and a race of giants is reignited when Jack, a young farmhand fighting for a kingdom and the love of a princess, opens a gateway between the two worlds.",CM
1737,Think Like a Man Too,2014,5.8,"All the couples are back for a wedding in Las Vegas, but plans for a romantic weekend go awry when their various misadventures get them into some compromising situations that threaten to derail the big event.",CM
1738,Barbershop 2: Back in Business,2004,5.8,"The owner of an historic South Side Chicago barbershop is pressured to sell out to a land developer, but must face the impact this would have on his close-knit community.",CM
1739,Now You See Me 2,2016,6.5,"The Four Horsemen resurface, and are forcibly recruited by a tech genius to pull off their most impossible heist yet.",CM
1740,About Schmidt,2002,7.2,"A man upon retirement, embarks on a journey to his estranged daughter's wedding, only to discover more about himself and life than he ever expected.",CM
1741,Exodus: Gods and Kings,2014,6.0,"The defiant leader Moses rises up against Egyptian Pharaoh Ramses II, setting six hundred thousand slaves on a monumental journey of escape from Egypt and its terrifying cycle of deadly plagues.",CM
1742,Wolf,1994,6.2,Publisher Will Randall becomes a werewolf and has to fight to keep his job.,CM
1743,Friday the 13th,2009,5.6,"A group of young adults discover a boarded up Camp Crystal Lake, where they soon encounter Jason Voorhees and his deadly intentions.",CM
1744,Pitch Perfect,2012,7.2,"Beca, a freshman at Barden University, is cajoled into joining The Bellas, her school's all-girls singing group. Injecting some much needed energy into their repertoire, The Bellas take on their male rivals in a campus competition.",CM
1745,The American President,1995,6.8,"Comedy-drama about a widowed U.S. President and a lobbyist who fall in love. It's all above-board, but ""politics is perception"", and sparks fly anyway.",CM
1746,Stuart Little 2,2002,5.5,Stuart and Snowbell set out across town to rescue a friend.,CM
1747,Mirror Mirror,2012,5.6,An evil queen steals control of a kingdom and an exiled princess enlists the help of seven resourceful rebels to win back her birthright.,CM
1748,Staying Alive,1983,4.5,It's five years later and Tony Manero's Saturday Night Fever is still burning. Now he's strutting toward his biggest challenge yet - succeeding as a dancer on the Broadway stage.,CM
1749,Mr. Mom,1983,6.5,"After he's laid off, a husband switches roles with his wife. She returns to the workforce, and he becomes a stay-at-home dad, a job he has no clue how to do.",CM
1750,The International,2009,6.5,An Interpol agent attempts to expose a high-profile financial institution's role in an international arms dealing ring.,CM
1751,Ex Machina,2014,7.7,A young programmer is selected to participate in a ground-breaking experiment in synthetic intelligence by evaluating the human qualities of a highly advanced humanoid A.I.,CM
1752,Tin Men,1987,6.5,A minor car accident drives two rival aluminum-siding salesmen to the ridiculous extremes of man versus man in 1963 Baltimore.,CM
1753,The Absent Minded Professor,1961,6.8,A college professor invents an anti-gravity substance which a corrupt businessman wants for himself.,CM
1754,Boyhood,2014,7.9,"The life of Mason, from early childhood to his arrival at college.",CM
1755,Can't Hardly Wait,1998,6.5,Multicharacter teenage comedy about high school graduates with different agenda of life on graduation night.,CM
1756,The Great Race,1965,7.3,"In the early 20th century, two rivals, the heroic Leslie and the despicable Professor Fate, engage in an epic automobile race from New York to Paris.",CM
1757,Heartburn,1986,6.1,A food writer pregnant with her second baby finds out her husband is having an affair.,CM
1758,The Woman in Red,1984,5.9,"On his way to work, Teddy spots Charlotte, an incredibly beautiful Woman in Red. He really wants to meet her, but what would his wife say?",CM
1759,The Transporter,2002,6.8,"Frank is hired to ""transport"" packages for unknown clients and has made a very good living doing so. But when asked to move a package that begins moving, complications arise.",CM
1760,Sweet November,2001,6.7,"A workaholic executive, and an unconventional woman agree to a personal relationship for a short period. In this short period she changes his life.",CM
1761,Top Five,2014,6.4,A comedian tries to make it as a serious actor when his reality television star fiance talks him into broadcasting their wedding on her television show.,CM
1762,Jersey Girl,2004,6.2,"After his career is sidelined by an unexpected tragedy and a personal blow-up, a single man must take care of his precocious daughter.",CM
1763,Irma la Douce,1963,7.4,"In Paris, a former policeman falls in love with a prostitute, and tries to get her out of that life by paying for all of her time.",CM
1764,Escape from New York,1981,7.2,"In 1997, when the U.S. president crashes into Manhattan, now a giant maximum security prison, a convicted bank robber is sent in to rescue him.",CM
1765,Alien Nation,1988,6.3,"In 1988, Earth makes the first contact with an alien civilization. In 1991, these aliens, known as Newcomers, slowly begin to be integrated into human society after three years of quarantine.",CM
1766,Black Widow,1987,6.3,"A federal investigator tracks down a gold digging woman who moves from husband to husband, kills them and collects the inheritance.",CM
1767,Aliens in the Attic,2009,5.4,A group of kids must protect their vacation home from invading aliens.,CM
1768,Don't Tell Mom the Babysitter's Dead,1991,6.2,Five siblings are left alone all summer when their mom leaves town and the evil babysitter bites the dust.,CM
1769,Twisted,2004,5.3,"Jessica, whose father killed her mother and committed suicide, is a police officer. While investigating a murder, she finds herself in the center of her own investigation, when her former lovers start being murdered.",CM
1770,Fallen,1998,7.0,"Homicide detective John Hobbes witnesses the execution of serial killer Edgar Reese. Soon after the execution the killings start again, and they are very similar to Reese's style.",CM
1771,Nurse Betty,2000,6.2,Comedy about a widow's post-traumatic obsession with a soap star.,CM
1772,The Morning After,1986,6.0,"A washed up, alcoholic actress who is prone to blackouts wakes up next to a murdered man. Did she kill him and, if not, is she in danger?",CM
1773,The Witch,2015,6.8,"A family in 1630s New England is torn apart by the forces of witchcraft, black magic, and possession.",CM
1774,Escape Plan,2013,6.7,"When a structural-security authority finds himself set up and incarcerated in the world's most secret and secure prison, he has to use his skills to escape with help from the inside.",CM
1775,Killer Elite,2011,6.5,"When his mentor is taken captive by a disgraced Arab sheik, a killer-for-hire is forced into action. His mission: kill three members of Britain's elite Special Air Service responsible for the death of his sons.",CM
1776,The Reaping,2007,5.7,"A former Christian missionary, who specializes in debunking religious phenomena, investigates a small town which seems to be suffering from the 10 biblical plagues.",CM
1777,All the Money in the World,2017,6.8,The story of the kidnapping of 16-year-old John Paul Getty III and the desperate attempt by his devoted mother to convince his billionaire grandfather Jean Paul Getty to pay the ransom.,CM
1778,The Cutting Edge,1992,6.9,A temperamental figure skater and a former hockey player try to win Olympic gold as a figure skating pairs team.,CM
1779,Problem Child 2,1991,4.7,"The worst child in the world makes an unthinkable discovery - there is another child even worse than him, and that's a girl.",CM
1780,Moscow on the Hudson,1984,6.5,"When a Russian musician defects in Bloomingdale's department store in New York, he finds adjusting to American life more difficult than he imagined.",CM
1781,Against All Odds,1984,5.9,"A gangster hires an ex-football player to find his girlfriend. When he finds her, they fall in love, and the twists start to appear.",CM
1782,Winchester,2018,5.4,"Ensconced in her sprawling California mansion, eccentric firearm heiress Sarah Winchester believes she is haunted by the souls of people killed by the Winchester repeating rifle.",CM
1783,Midnight in the Garden of Good and Evil,1997,6.6,"A visiting city reporter's assignment suddenly revolves around the murder trial of a local millionaire, whom he befriends.",CM
1784,Alpha and Omega,2010,5.3,"Two young wolves at opposite ends of their pack's social order are thrown together into a foreign land and need each other to return home, but love complicates everything.",CM
1785,Navy Seals,1990,5.5,A Navy Seal team must set out to destroy a shipment of US-built Stinger missiles that have fallen into terrorist hands.,CM
1786,Wyatt Earp,1994,6.7,The story of Wyatt Earp as he interacts and battles other famous figures of the Wild West era.,CM
1787,The Wood,1999,7.0,"While dealing with a friend's cold feet on his wedding day, a writer reminisces about his youth with his best friends.",CM
1788,Grindhouse,2007,7.6,Quentin Tarantino and Robert Rodriguez's homage to exploitation double features in the 60s and 70s with two back-to-back cult films that include previews of coming attractions between them.,CM
1789,Ernest Goes to Jail,1990,5.4,"Bumbling Ernest P. Worrell is assigned to jury duty, where a crooked lawyer notices a resemblance with crime boss Mr. Nash, and arranges a switch. Nash assumes Ernest's job as a bank ... See full summary&nbsp;",CM
1790,In the Heart of the Sea,2015,6.9,"A recounting of a New England whaling ship's sinking by a giant whale in 1820, an experience that later inspired the great novel Moby-Dick.",CM
1791,Little Man Tate,1991,6.7,"Dede is a sole parent trying to bring up her son Fred. When it is discovered that Fred is a genius, she is determined to ensure that Fred has all the opportunities that he needs, and that ... See full summary&nbsp;",CM
1792,In the Name of the Father,1993,8.1,A man's coerced confession to an IRA bombing he did not commit results in the imprisonment of his father as well. An English lawyer fights to free them.,CM
1793,Piranha 3D,2010,5.4,"After a sudden underwater tremor sets free scores of the prehistoric man-eating fish, an unlikely group of strangers must band together to stop themselves from becoming fish food for the area's new razor-toothed residents.",CM
1794,The Hills Have Eyes,1977,6.4,"On the way to California, a family has the misfortune to have their car break down in an area closed to the public, and inhabited by violent savages ready to attack.",CM
1795,Logan's Run,1976,6.8,An idyllic science fiction future has one major drawback: life must end at the age of thirty.,CM
1796,Thunderbolt and Lightfoot,1974,7.1,"With the help of an irreverent young sidekick, a bank robber gets his old gang back together to organize a daring new heist.",CM
1797,Enter the Dragon,1973,7.7,A martial artist agrees to spy on a reclusive crime lord using his invitation to a tournament there as cover.,CM
1798,Fritz the Cat,1972,6.3,A hypocritical swinging college student cat raises hell in a satiric vision of various elements on the 1960s.,CM
1799,Some Like It Hot,1959,8.2,"When two male musicians witness a mob hit, they flee the state in an all-female band disguised as women, but further complications set in.",CM
1800,The November Man,2014,6.3,An ex-C.I.A. operative is brought back in on a very personal mission and finds himself pitted against his former pupil in a deadly game involving high level C.I.A. officials and the Russian President-elect.,CM
1801,Invasion of the Body Snatchers,1978,7.4,"In San Francisco, a group of people discover the human race is being replaced one by one, with clones devoid of emotion.",CM
1802,Kingpin,1996,6.9,"A star bowler whose career was prematurely ""cut off"" hopes to ride a new prodigy to success and riches.",CM
