_id,title,release_year,movie_rating,summary,Up_System
0,Aliens vs. Predator: Requiem,2007,4.7,"Warring Alien and Predator races descend on a rural Colorado town, where unsuspecting residents must band together for any chance of survival.",CM
1,The Hills Have Eyes,2006,6.4,"A suburban American family is being stalked by a group of psychotic people who live in the desert, far away from civilization.",CM
2,Easy Rider,1969,7.4,"Through the open country and desert lands, two bikers head from L.A to New Orleans, and along the way, meet a man who bridges a counter-culture gap they are unaware of.",CM
3,Almost Christmas,2016,6.1,A dysfunctional family gathers together for their first Christmas since their mom died.,CM
4,"Oh, God!",1977,6.6,"When God appears to an assistant grocery manager as a good natured old man, the Almighty selects him as his messenger for the modern world.",CM
5,The Hours,2002,7.6,"The story of how the novel ""Mrs. Dalloway"" affects three generations of women, all of whom, in one way or another, have had to deal with suicide in their lives.",CM
6,Cheech and Chong's Next Movie,1980,6.1,"The two stoners and their friends go through another series of crazy, drug-influenced misadventures.",CM
7,Starting Over,1979,6.5,"A divorced man falls in love, but somehow he can't get over his ex-wife. This affects his love life in comic ways. Based on Dan Wakefield's novel.",CM
8,Ronin,1998,7.3,A freelancing former U.S. Intelligence Agent tries to track down a mysterious package that is wanted by the Irish and the Russians.,CM
9,Orphan,2009,7.0,A husband and wife who recently lost their baby adopt a 9 year-old girl who is not nearly as innocent as she claims to be.,CM
10,Bandits,2001,6.5,Two bank robbers fall in love with the girl they've kidnapped.,CM
11,High Crimes,2002,6.4,"High powered lawyer Claire Kubik finds her world turned upside down when her husband, who has been living under a false name, is arrested by military police and placed on trial for the murder of villagers while he was in the Marines.",CM
12,Three Days of the Condor,1975,7.5,"A bookish CIA researcher finds all his co-workers dead, and must outwit those responsible until he figures out who he can really trust.",CM
13,Gremlins 2: The New Batch,1990,6.4,"The Gremlins are back, and this time, they've taken control of a New York City media mogul's high-tech skyscraper.",CM
14,The Great Outdoors,1988,6.6,A Chicago man's hope for a peaceful family vacation in the woods is shattered when the annoying in-laws drop in.,CM
15,Pale Rider,1985,7.3,A mysterious preacher protects a humble prospector village from a greedy mining company trying to encroach on their land.,CM
16,Secondhand Lions,2003,7.6,"A coming-of-age story about a shy, young boy sent by his irresponsible mother to spend the summer with his wealthy, eccentric uncles in Texas.",CM
17,About a Boy,2002,7.1,"A cynical, immature young man is taught how to act like a grown-up by a little boy.",CM
18,Peggy Sue Got Married,1986,6.3,"Peggy Sue faints at a high school reunion. When she wakes up, she finds herself in her own past, just before she finished school.",CM
19,Gosford Park,2001,7.3,The lives of upstairs guests and downstairs servants at a party in 1932 in a country house in England as they investigate a murder involving one of them.,CM
20,Tequila Sunrise,1988,6.0,"A former L.A. drug dealer tries to go straight but his past and his underworld connections bring him into the focus of the DEA, the Mexican feds and the Mexican drug cartels.",CM
21,The Peacemaker,1997,5.9,A US Army colonel and a civilian woman supervising him must track down stolen Russian nuclear weapons before they're used by terrorists.,CM
22,The Mirror Has Two Faces,1996,6.5,"A shy, middle-aged professor enters into a romantic but non-physical relationship with an unlucky-in-love colleague.",CM
23,A Walk to Remember,2002,7.4,"The story of two North Carolina teens, Landon Carter and Jamie Sullivan, who are thrown together after Landon gets into trouble and is made to do community service.",CM
24,Private Parts,1997,6.8,"The autobiographical story of Howard Stern, the radio rebel who is now also a TV personality, an author and a movie star.",CM
25,Valerian and the City of a Thousand Planets,2017,6.5,"A dark force threatens Alpha, a vast metropolis and home to species from a thousand planets. Special operatives Valerian and Laureline must race to identify the marauding menace and safeguard not just Alpha, but the future of the universe.",CM
26,What to Expect When You're Expecting,2012,5.7,"Follows the lives of five interconnected couples as they experience the thrills and surprises of having a baby and realize that no matter what you plan for, life does not always deliver what is expected.",CM
27,Clash of the Titans,1981,6.9,Perseus must battle Medusa and the Kraken to save the Princess Andromeda.,CM
28,Money Talks,1997,6.2,"Sought by police and criminals, a small-time huckster makes a deal with a TV newsman for protection.",CM
29,The Last Exorcism,2010,5.6,A troubled evangelical minister agrees to let his last exorcism be filmed by a documentary crew.,CM
30,Orange County,2002,6.2,A guidance counselor mistakenly sends out the wrong transcripts to Stanford University under the name of an over-achieving high schooler.,CM
31,Money Monster,2016,6.5,Financial TV host Lee Gates and his producer Patty are put in an extreme situation when an irate investor takes them and their crew as hostage.,CM
32,John Tucker Must Die,2006,5.8,Three ex-girlfriends of a serial cheater set up their former lover to fall for the new girl in town so they can watch him get his heart broken.,CM
33,End of Watch,2012,7.6,"Shot documentary-style, this film follows the daily grind of two young police officers in LA who are partners and friends, and what happens when they meet criminal forces greater than themselves.",CM
34,Poltergeist II: The Other Side,1986,5.7,"The Freeling family have a new house, but their troubles with supernatural forces don't seem to be over.",CM
35,The Siege,1998,6.3,"The secret U.S. abduction of a suspected terrorist leads to a wave of terrorist attacks in New York City, which leads to the declaration of martial-law.",CM
36,The Ides of March,2011,7.1,An idealistic staffer for a new presidential candidate gets a crash course on dirty politics during his stint on the campaign trail.,CM
37,Rocky V,1990,5.2,"Reluctantly retired from boxing, and back from riches to rags, Rocky takes on a new protege who betrays him, as the champ's son must adjust to his family's new life after bankruptcy.",CM
38,Windtalkers,2002,6.0,"Two U.S. Marines in World War II are assigned to protect Navajo Marines, who use their native language as an unbreakable radio cypher.",CM
39,Out of Time,2003,6.5,A Florida police chief must solve a vicious double homicide before he himself falls under suspicion.,CM
40,Falling Down,1993,7.6,"An unemployed defense worker frustrated with the various flaws he sees in society, begins to psychotically and violently lash out against them.",CM
41,Pee-wee's Big Adventure,1985,7.0,"When eccentric man-child Pee-wee Herman gets his beloved bike stolen in broad daylight, he sets out across the U.S. on the adventure of his life.",CM
42,Revenge of the Nerds,1984,6.6,"At Adams College, a group of bullied outcasts and misfits resolve to fight back for their peace and self-respect.",CM
43,The Star,2017,6.1,A small but brave donkey and his animal friends become the unsung heroes of the first Christmas.,CM
44,House on Haunted Hill,1999,5.6,"An amusement park mogul offers a group of diverse people $1,000,000 to spend the night in a haunted house with a horrifying past.",CM
45,"Love, Simon",2018,7.6,"Simon Spier keeps a huge secret from his family, his friends and all of his classmates: he's gay. When that secret is threatened, Simon must face everyone and come to terms with his identity.",CM
46,Truth or Dare,2018,5.1,A harmless game of Truth or Dare among friends turns deadly when someone -- or something -- begins to punish those who tell a lie or refuse the dare.,CM
47,Absence of Malice,1981,6.9,"When a prosecutor leaks a false story that a liquor warehouse owner is involved in the murder of a union head, the man's life begins to unravel.",CM
48,Short Circuit,1986,6.6,"Number 5 of a group of experimental robots in a lab is electrocuted, suddenly becomes intelligent, and escapes.",CM
49,Encino Man,1992,5.7,"When they find a frozen caveman in their back yard, two high school outcasts thaw him and introduce him to modern life while he in turn gets them to actually enjoy life.",CM
50,Max Payne,2008,5.4,"Coming together to solve a series of murders in New York City are a police detective whose family was slain as part of a conspiracy and an assassin out to avenge her sister's death. The duo will be hunted by the police, the mob, and a ruthless corporation.",CM
51,Three Fugitives,1989,6.1,"A reformed bank robber is taken hostage by a desperate man during a bank hold up, but is forced to go on the run with his captor when they're both mistakenly thought to be in cahoots.",CM
52,The Dark Crystal,1982,7.2,"On another planet in the distant past, a Gelfling embarks on a quest to find the missing shard of a magical crystal, and so restore order to his world.",CM
53,Duplicity,2009,6.2,"Two ex-government agents turned rival industrial spies have to be at the top of their game when one of their companies prepares to launch a major product. However, they distract each other in more ways than one.",CM
54,Pleasantville,1998,7.5,"Two 1990s teenage siblings find themselves in a 1950s sitcom, where their influence begins to profoundly change that complacent world.",CM
55,Ghost in the Shell,2017,6.4,"In the near future, Major Mira Killian is the first of her kind: A human saved from a terrible crash, who is cyber-enhanced to be a perfect soldier devoted to stopping the world's most dangerous criminals.",CM
56,Jagged Edge,1985,6.5,"A wealthy woman is murdered in her beach house. The husband is allegedly knocked out first. He inherits all her inherited wealth. He has a female corporate lawyer, criminal prosecutor 4 years ago, represent him in court. Guilty?",CM
57,Bill &amp; Ted's Excellent Adventure,1989,6.9,Two seemingly dumb teens set off on a quest to prepare the ultimate historical presentation with the help of a time machine.,CM
58,Pretty in Pink,1986,6.8,A poor girl must choose between the affections of dating her childhood sweetheart or a rich but sensitive playboy.,CM
59,The Fly,1986,7.5,A brilliant but eccentric scientist begins to transform into a giant man/fly hybrid after one of his experiments goes horribly wrong.,CM
60,Paddington 2,2017,7.9,"Paddington, now happily settled with the Brown family and a popular member of the local community, picks up a series of odd jobs to buy the perfect present for his Aunt Lucy's 100th birthday, only for the gift to be stolen.",CM
61,The Water Horse,2007,6.5,A lonely boy discovers a mysterious egg that hatches a sea creature of Scottish legend.,CM
62,Blue Crush,2002,5.7,"As a hard-core surfer girl prepares for a big competition, she finds herself falling for a football player.",CM
63,Reds,1981,7.4,"A radical American journalist becomes involved with the Communist revolution in Russia, and hopes to bring its spirit and idealism to the United States.",CM
64,The Master of Disguise,2002,3.3,An Italian waiter fights off a criminal mastermind with his inherited powers of disguise.,CM
65,Swiss Family Robinson,1960,7.2,A Swiss family must survive being shipwrecked on a deserted island.,CM
66,Heartbreakers,2001,6.2,A mother and daughter con team seduce and scam wealthy men.,CM
67,I Am Sam,2001,7.6,A mentally handicapped man fights for custody of his 7-year-old daughter and in the process teaches his cold-hearted lawyer the value of love and family.,CM
68,Hanna,2011,6.8,"A sixteen-year-old girl who was raised by her father to be the perfect assassin is dispatched on a mission across Europe, tracked by a ruthless intelligence agent and her operatives.",CM
69,Mo' Money,1992,5.5,"Trying to get his act together, a con artist gets a job in a credit card company. He falls in love with a fellow employee, he steals a couple of cards, everything is going great. But soon, ... See full summary&nbsp;",CM
70,Bridget Jones: The Edge of Reason,2004,6.0,"After finding love, Bridget Jones questions if she really has everything she's dreamed of having.",CM
71,There Will Be Blood,2007,8.2,"A story of family, religion, hatred, oil and madness, focusing on a turn-of-the-century prospector in the early days of the business.",CM
72,Hardball,2001,6.4,"An aimless young man who is scalping tickets, gambling, and drinking, agrees to coach a Little League team from the Cabrini Green housing project in Chicago as a condition of getting a loan from a friend.",CM
73,Yentl,1983,6.7,A Jewish girl disguises herself as a boy to enter religious training.,CM
74,Catwoman,2004,3.3,"A shy woman, endowed with the speed, reflexes, and senses of a cat, walks a thin line between criminal and hero, even as a detective doggedly pursues her, fascinated by both of her personas.",CM
75,2010,1984,6.8,A joint U.S.-Soviet expedition is sent to Jupiter to learn what happened to the Discovery.,CM
76,Legion,2010,5.2,"When a group of strangers at a dusty roadside diner come under attack by demonic forces, their only chance for survival lies with an archangel named Michael, who informs a pregnant waitress that her unborn child is humanity's last hope.",CM
77,The Piano,1993,7.6,"A mute woman is sent to 1850s New Zealand along with her young daughter and prized piano for an arranged marriage to a wealthy landowner, but is soon lusted after by a local worker on the plantation.",CM
78,Big Business,1988,6.4,Two couples of sisters from New York and from the countryside discover that they are connected in an incredible way.,CM
79,Stranger Than Fiction,2006,7.6,"An I.R.S. auditor suddenly finds himself the subject of narration only he can hear: narration that begins to affect his entire life, from his work, to his love-interest, to his death.",CM
80,Resident Evil,2002,6.7,"A special military unit fights a powerful, out-of-control supercomputer and hundreds of scientists who have mutated into flesh-eating creatures after a laboratory accident.",CM
81,The Wild Thornberrys Movie,2002,5.4,"Eliza and Debbie are two sisters who don't always get along. But their relationship is put to the test when Debbie's life is in danger, and Eliza might have to give up her power to talk to animals....",CM
82,Pete's Dragon,1977,6.4,An orphan boy and his magical dragon come to town with his abusive adoptive parents in pursuit.,CM
83,Hannah and Her Sisters,1986,7.9,"Between two Thanksgivings two years apart, Hannah's husband falls in love with her sister Lee, while her hypochondriac ex-husband rekindles his relationship with her sister Holly.",CM
84,Righteous Kill,2008,6.0,Two veteran New York City detectives work on a case of serial executions of criminals who escaped justice.,CM
85,Collateral Damage,2002,5.5,"After his family is killed by a terrorist act, a firefighter goes in search of the one responsible.",CM
86,Man of the House,1995,5.1,"A young boy refuses to accept his mother's new boyfriend, a lawyer, despite the man's attempts to win his respect, while disgruntled relatives of a criminal he prosecuted seek revenge.",CM
87,Allied,2016,7.1,"In 1942, a Canadian intelligence officer in North Africa encounters a female French Resistance fighter on a deadly mission behind enemy lines. When they reunite in London, their relationship is tested by the pressures of war.",CM
88,You Got Served,2004,3.6,"In order to achieve their dream of opening a recording studio, two friends (Omarion, Houston) must first win their city's dance contest -- a fierce competition that pits them against a group of tough street dancers.",CM
89,The Faculty,1998,6.5,Students suspect that their teachers are aliens after bizarre occurrences.,CM
90,Funny Lady,1975,6.5,Story of singer Fanny Brice's stormy relationship with showman Billy Rose.,CM
91,Roxanne,1987,6.6,The large-nosed C.D. Bales is in love with the beautiful Roxanne; she falls for his personality but another man's looks.,CM
92,A Haunted House,2013,5.1,"Malcolm and Kisha move into their dream home, but soon learn a demon also resides there. When Kisha becomes possessed, Malcolm - determined to keep his sex life on track - turns to a priest, a psychic, and a team of ghost-busters for help.",CM
93,Enough,2002,5.7,"After running away fails, a terrified woman empowers herself in order to battle her abusive husband.",CM
94,I Still Know What You Did Last Summer,1998,4.6,"The murderous fisherman with a hook is back to once again stalk the two surviving teens, Julie and Ray, who had left him for dead, as well as cause even more murder and mayhem, this time at a posh island resort.",CM
95,Gone in 60 Seconds,1974,6.5,"When a South American drug lord pays Pace to steal 48 cars for him, all but one is in the bag - thereby, the police precipitate in a desperate car chase against Pace and his Eleanor across Southern California.",CM
96,The Illusionist,2006,7.6,"In turn-of-the-century Vienna, a magician uses his abilities to secure the love of a woman far above his social standing.",CM
97,Caddyshack,1980,7.3,An exclusive golf course has to deal with a brash new member and a destructive dancing gopher.,CM
98,The Ladykillers,2004,6.2,"An eccentric, if not charming Southern professor and his crew pose as a classical ensemble in order to rob a casino, all under the nose of his unsuspecting but sharp old landlady.",CM
99,The Beach,2000,6.6,"Vicenarian Richard travels to Thailand and finds himself in possession of a strange map. Rumours state that it leads to a solitary beach paradise, a tropical bliss. Excited and intrigued, he sets out to find it.",CM
100,Friday the 13th,1980,6.5,"A group of camp counselors are stalked and murdered by an unknown assailant while trying to reopen a summer camp which, years before, was the site of a child's drowning.",CM
101,Epic Movie,2007,2.4,"A comedic satire of films that are large in scope, reputation and popularity.",CM
102,Hitman,2007,6.3,"A gun-for-hire known only as Agent 47 hired by a group known only as 'The Organization' is ensnared in a political conspiracy, which finds him pursued by both Interpol and the Russian military as he treks across Russia and Eastern Europe.",CM
103,Jackie Brown,1997,7.5,A middle-aged woman finds herself in the middle of a huge conflict that will either make her a profit or cost her life.,CM
104,Out for Justice,1991,6.1,The gruesome murder of a Brooklyn Detective will turn the case into a personal vendetta when the deceased's best friend and fellow officer will unleash an all-out attack against a psychotic Mafia enforcer's brutal gang.,CM
105,30 Days of Night,2007,6.6,"After an Alaskan town is plunged into darkness for a month, it is attacked by a bloodthirsty gang of vampires.",CM
106,Conan the Barbarian,1982,6.9,"A young boy, Conan, becomes a slave after his parents are killed and tribe destroyed by a savage warlord and sorcerer, Thulsa Doom. When he grows up he becomes a fearless, invincible fighter. Set free, he plots revenge against Thulsa Doom.",CM
107,Benji,1974,6.2,A stray dog saves two kidnapped children.,CM
108,The Texas Chainsaw Massacre: The Beginning,2006,5.9,"Before being sent to serve in Vietnam, two brothers and their girlfriends take one last road trip, but when they get into an accident, a terrifying experience will take them to a secluded house of horrors, with a chainsaw-wielding killer.",CM
109,Hocus Pocus,1993,6.8,"A curious youngster moves to Salem, where he struggles to fit in before awakening a trio of diabolical witches that were executed in the 17th century.",CM
110,Nobody's Fool,1994,7.4,A stubborn man past his prime reflects on his life of strict independence and seeks more from himself.,CM
111,Little Nicky,2000,5.3,"After two of the devil's three sons escape Hell to wreak havoc on Earth, the devil must send his third son, the mild-mannered Nicky, to bring them back before it's too late.",CM
112,Crazy Heart,2009,7.3,A faded country music musician is forced to reassess his dysfunctional life during a doomed romance that also inspires him.,CM
113,Burlesque,2010,6.4,A small-town girl ventures to Los Angeles and finds her place in a neo-burlesque club run by a former dancer.,CM
114,Joe Versus the Volcano,1990,5.8,"When a hypochondriac learns that he is dying, he accepts an offer to throw himself in a volcano at a tropical island, and along the way there, learns to truly live.",CM
115,Rugrats Go Wild,2003,5.6,"The Rugrats get tangled in an exotic adventure, where they're helped by the Thornberrys, a family that travels the world making nature documentaries.",CM
116,Body of Lies,2008,7.1,A CIA agent on the ground in Jordan hunts down a powerful terrorist leader while being caught between the unclear intentions of his American supervisors and Jordan Intelligence.,CM
117,Dead Man Walking,1995,7.5,"A nun, while comforting a convicted killer on death row, empathizes with both the killer and his victim's families.",CM
118,The Expendables 3,2014,6.1,"Barney augments his team with new blood for a personal battle: to take down Conrad Stonebanks, the Expendables co-founder and notorious arms trader who is hell bent on wiping out Barney and every single one of his associates.",CM
119,Blind Date,1987,5.9,"A workaholic needs a date for a dinner with new important clientele, but who his brother sets him up with could lead to disaster.",CM
120,Second Act,2018,5.8,A big box store worker reinvents her life and her life-story and shows Madison Avenue what street smarts can do.,CM
121,Lakeview Terrace,2008,6.1,"Based on a true story, a troubled and racist African-American L.A.P.D. Officer will stop at nothing to force out a friendly interracial couple who just moved in next door to him.",CM
122,Anna and the King,1999,6.7,"The story of the romance between the King of Siam and widowed British schoolteacher, Anna Leonowens, during the 1860s.",CM
123,Three Amigos!,1986,6.5,"Three actors accept an invitation to a Mexican village to perform their onscreen bandit fighter roles, unaware that it is the real thing.",CM
124,Pitch Black,2000,7.1,"A commercial transport ship and its crew are marooned on a planet full of bloodthirsty creatures that only come out to feast at night. But then, they learn that a month-long eclipse is about to occur.",CM
125,Annie Hall,1977,8.0,Neurotic New York comedian Alvy Singer falls in love with the ditzy Annie Hall.,CM
126,The Adventures of Sharkboy and Lavagirl 3-D,2005,3.5,A young boy is recruited by his imaginary friends Sharkboy and Lavagirl to help save their planet.,CM
127,King Arthur: Legend of the Sword,2017,6.8,"Robbed of his birthright, Arthur comes up the hard way in the back alleys of the city. But once he pulls the sword from the stone, he is forced to acknowledge his true legacy - whether he likes it or not.",CM
128,The Grudge 2,2006,5.0,Three interwoven stories about a terrible curse. A young woman encounters a malevolent supernatural force while searching for her missing sister in Tokyo; a mean high school prank goes horribly wrong; a woman with a deadly secret moves into a Chicago apartment building.,CM
129,The Crazies,2010,6.5,"After a strange and insecure plane crash, an unusual toxic virus enters a quaint farming town. A young couple are quarantined, but they fight for survival along with help from a couple of people.",CM
130,The Sword and the Sorcerer,1982,5.6,A mercenary with a three-bladed sword rediscovers his royal heritage's dangerous future when he is recruited to help a princess foil the designs of a brutal tyrant and a powerful sorcerer in conquering a land.,CM
131,Wonder Park,2019,5.7,Wonder Park tells the story of an amusement park where the imagination of a wildly creative girl named June comes alive.,CM
132,What's Love Got to Do with It,1993,7.3,"The story of singer Tina Turner's rise to stardom and how she gained the courage to break free from her abusive husband, Ike Turner.",CM
133,The Longest Day,1962,7.8,"The events of D-Day, told on a grand scale from both the Allied and German points of view.",CM
134,Something Borrowed,2011,5.9,"Friendships are tested and secrets come to the surface when terminally single Rachel falls for Dex, her best friend Darcy's fianc.",CM
135,Fracture,2007,7.2,"An attorney, intent on climbing the career ladder toward success, finds an unlikely opponent in a manipulative criminal he is trying to prosecute.",CM
136,The Sisterhood of the Traveling Pants,2005,6.5,Four best girlfriends hatch a plan to stay connected with one another as their lives start off in different directions: they pass around a pair of secondhand jeans that fits each of their bodies perfectly.,CM
137,Primary Colors,1998,6.7,A man joins the political campaign of a smooth-operator candidate for president of the USA.,CM
138,The Karate Kid Part III,1989,5.1,"Ostracised villain John Kreese attempts to gain revenge on Daniel and Miyagi, with the help of a Vietnam War comrade, the wealthy owner of a toxic waste disposal business.",CM
139,Earth to Echo,2014,5.8,"After receiving a bizarre series of encrypted messages, a group of kids embark on an adventure with an alien who needs their help.",CM
140,Hot Shots! Part Deux,1993,6.6,"Rambo"" parody in which Topper Harley leads a rescue team into Iraq to save Iraqi war prisoners and all of their previous rescue teams.",CM
141,Romeo and Juliet,1968,7.6,"When two young members of feuding families meet, forbidden love ensues.",CM
142,French Kiss,1995,6.6,"A woman flies to France to confront her straying fianc, but gets into trouble when the charming crook seated next to her uses her for smuggling.",CM
