_id,title,release_year,movie_rating,summary,Up_System
2358,Deck the Halls,2006,4.9,Two neighbors have it out after one of them decorates his house for the holidays so brightly that it can be seen from space.,CM
2359,Pan,2015,5.8,"Twelve-year-old orphan Peter is spirited away to the magical world of Neverland, where he finds both fun and danger, and ultimately discovers his destiny -- to become the hero who will be for ever known as Peter Pan.",CM
2360,The Hot Chick,2002,5.5,"An attractive and popular teenager, who is mean-spirited toward others, finds herself in the body of an older man, and must find a way to get back to her original body.",CM
2361,Step Up Revolution,2012,6.5,"Emily arrives in Miami with aspirations to become a professional dancer. She sparks with Sean, the leader of a dance crew whose neighborhood is threatened by Emily's father's development plans.",CM
2362,Drive,2011,7.8,A mysterious Hollywood stuntman and mechanic moonlights as a getaway driver and finds himself in trouble when he helps out his neighbor.,CM
2363,Green Zone,2010,6.8,Discovering covert and faulty intelligence causes a U.S. Army officer to go rogue as he hunts for Weapons of Mass Destruction in an unstable region.,CM
2364,A Very Harold &amp; Kumar 3D Christmas,2011,6.3,"Six years after their Guantanamo Bay adventure, stoner buds Harold Lee and Kumar Patel cause a holiday fracas by inadvertently burning down Harold's father-in-law's prize Christmas tree.",CM
2365,Good Deeds,2012,5.5,"Businessman Wesley Deeds is jolted out of his scripted life when he meets Lindsey, a single mother who works on the cleaning crew in his office building.",CM
2366,50/50,2011,7.7,"Inspired by a true story, a comedy centered on a 27-year-old guy who learns of his cancer diagnosis and his subsequent struggle to beat the disease.",CM
2367,The Skulls,2000,5.6,"A senior at an ivy league college, who depends on scholarships and working on the side, gets accepted into the secret society The Skulls. He hopes it betters chances at Harvard but The Skulls is not what he thought and comes at a price.",CM
2368,Ghoulies,1984,4.1,"A young man and his girlfriend move into an old mansion home, where he becomes possessed by a desire to control ancient demons.",CM
2369,Midnight Express,1978,7.6,"Billy Hayes, an American college student, is caught smuggling drugs out of Turkey and thrown into prison.",CM
2370,"Aloha, Bobby and Rose",1975,6.3,"Bobby and Rose, two youngsters who are in love, have to run away from home when they are falsely accused to have committed a robbery and an assassination.",CM
2371,Giant,1956,7.7,Sprawling epic covering the life of a Texas cattle rancher and his family and associates.,CM
2372,Red Heat,1988,6.1,A tough Russian policeman is forced to partner up with a cocky Chicago police detective when he is sent to Chicago to apprehend a Georgian drug lord who killed his partner and fled the country.,CM
2373,Excalibur,1981,7.4,"Merlin the magician helps Arthur Pendragon unite the Britons around the Round Table of Camelot, even as dark forces conspire to tear it apart.",CM
2374,Good Luck Chuck,2007,5.6,"In order to keep the woman of his dreams from falling for another guy, Charlie Logan has to break the curse that has made him wildly popular with single women: Sleep with Charlie once, and the next man you meet will be your true love.",CM
2375,The 5th Wave,2016,5.2,"Four waves of increasingly deadly alien attacks have left most of Earth decimated. Cassie is on the run, desperately trying to save her younger brother.",CM
2376,Ouija: Origin of Evil,2016,6.1,"In 1967 Los Angeles, a widowed mother and her daughters add a new stunt to bolster their seance scam business by inviting an evil presence into their home, not realizing how dangerous it is.",CM
2377,Places in the Heart,1984,7.4,"In central Texas in the 1930s, a widow, with two small children, tries to run her small 40-acre farm with the help of two disparate people.",CM
2378,The Bible: In the Beginning...,1966,6.3,"Extravagant production of the first part of the book of Genesis. Covers Adam and Eve, Noah and the Flood and Abraham and Isaac.",CM
2379,Mom and Dad,1945,5.2,"Because a high school girl's parents refuse to discuss sex education (called ""personal hygiene"" in the film) with her, she gets pregnant by her boyfriend, who conveniently dies. Her parents... See full summary&nbsp;",CM
2380,Freddy's Dead: The Final Nightmare,1991,4.9,"Dream-haunting Freddy Krueger returns once again to prowl the nightmares of Springwood's last surviving teenager, and of a woman whose personal connection to Krueger may mean his doom.",CM
2381,White Fang,1991,6.7,Jack London's classic adventure story about the friendship developed between a Yukon gold hunter and the mixed dog-wolf he rescues from the hands of a man who mistreats him.,CM
2382,A Thin Line Between Love and Hate,1996,5.7,"An observable, fast-talking party man Darnell Wright, gets his punishment when one of his conquests takes it personally and comes back for revenge in this 'Fatal Attraction'-esque comic ... See full summary&nbsp;",CM
2383,Take the Lead,2006,6.7,The real story of a dance teacher who believed in the talent of a group of problem kids.,CM
2384,Psycho II,1983,6.5,"After twenty-two years of psychiatric care, Norman Bates attempts to return to a life of solitude, but the specters of his crimes - and his mother - continue to haunt him.",CM
2385,The Killing Fields,1984,7.9,"A journalist is trapped in Cambodia during tyrant Pol Pot's bloody 'Year Zero' cleansing campaign, which claimed the lives of two million 'undesirable' civilians.",CM
2386,Dangerous Liaisons,1988,7.6,A scheming widow and her manipulative ex-lover make a bet regarding the corruption of a recently married woman.,CM
2387,Judge Dredd,1995,5.5,"In a dystopian future, Joseph Dredd, the most famous Judge (a police officer with instant field judiciary powers), is convicted for a crime he did not commit and must face his murderous counterpart.",CM
2388,The Other Side of the Mountain,1975,6.4,Young ski champion Jill Kinmont is left paralyzed after a tragic skiing accident. Her best friend suffers the same fate after contracting polio. Jill must slowly put her life back together again with the help of those close to her.,CM
2389,Licence to Kill,1989,6.6,"James Bond goes rogue and sets off to unleash vengeance on a drug lord who tortured his best friend, a C.I.A. Agent, and left him for dead and murdered his bride after he helped capture him.",CM
2390,Addicted to Love,1997,6.1,"Maggie's and Sam's former partners are in love; she wants revenge and he wants his lost love back, so they work together to break up the happy couple.",CM
2391,Hostage,2005,6.6,"When a family is held hostage, former hostage negotiator Jeff Talley arrives at the scene. Talley's own family is kidnapped and Talley must decide which is more important: saving a family he doesn't even know or saving his own family.",CM
2392,The 6th Day,2000,5.9,Futuristic action about a man who meets a clone of himself and stumbles into a grand conspiracy about clones taking over the world.,CM
2393,Cradle 2 the Grave,2003,5.8,"A jewel thief's daughter is kidnapped after he steals a collection of prized black diamonds, which aren't at all what they seem.",CM
2394,Mississippi Burning,1988,7.8,"Two F.B.I. Agents, with wildly different styles, arrive in Mississippi to investigate the disappearance of some civil rights activists.",CM
2395,Forbidden Kingdom,2014,5.3,"An eighteenth century English cartographer, Jonathan Green, sets out on a journey to map the uncharted lands of Transylvania, only to discover the dark secrets and dangerous creatures hidden in a cursed, fantastical Romanian forest.",CM
2396,Thirteen Days,2000,7.3,"In October 1962, the Kennedy administration struggles to contain the Cuban Missile Crisis.",CM
2397,Man on the Moon,1999,7.4,The life and career of legendary comedian Andy Kaufman.,CM
2398,Hawaii,1966,6.6,"An American missionary and his wife travel to the exotic island kingdom of Hawaii, intent on converting the natives. But the clash between the two cultures is too great and instead of understanding there comes tragedy.",CM
2399,Jack Frost,1998,5.3,"A father who can't keep his promises, dies in a car accident. One year later, he returns as a snowman, who has the final chance to put things right with his son, before he is gone forever.",CM
2400,Concussion,2015,7.1,"In Pittsburgh, accomplished pathologist Dr. Bennet Omalu uncovers the truth about brain damage in football players who suffer repeated concussions in the course of normal play.",CM
2401,Courageous,2011,7.1,"When a tragedy strikes close to home, four police officers struggle with their faith and their roles as husbands and fathers; together they make a decision that will change all of their lives.",CM
2402,Hot Pursuit,2015,5.1,An uptight and by-the-book cop tries to protect the outgoing widow of a drug boss as they race through Texas pursued by crooked cops and murderous gunmen.,CM
2403,Monster,2003,7.3,"Based on the life of Aileen Wuornos, a Daytona Beach prostitute who became a serial killer.",CM
2404,Eternal Sunshine of the Spotless Mind,2004,8.3,"When their relationship turns sour, a couple undergoes a medical procedure to have each other erased from their memories.",CM
2405,The Foreigner,2017,7.0,"A humble businessman with a buried past seeks justice when his daughter is killed in an act of terrorism. A cat-and-mouse conflict ensues with a government official, whose past may hold clues to the killers' identities.",CM
2406,Like Father Like Son,1987,5.1,A mysterious potion switches the personalities of a buttoned up doctor and his laid back son.,CM
2407,Adventures in Babysitting,1987,6.9,A babysitter must battle her way through the big city after being stranded there with the kids she's looking after.,CM
2408,Inferno,2016,6.2,"When Robert Langdon wakes up in an Italian hospital with amnesia, he teams up with Dr. Sienna Brooks, and together they must race across Europe against the clock to foil a deadly global plot.",CM
2409,Texas Chainsaw 3D,2013,4.8,A young woman travels to Texas to collect an inheritance; little does she know that an encounter with a chainsaw-wielding killer is part of the reward.,CM
2410,Thoroughly Modern Millie,1967,7.0,"Millie comes to town in the roaring twenties to encounter flappers, sexuality and white slavers.",CM
2411,Little Darlings,1980,6.5,Two fifteen year-old girls from different sides of the tracks compete to see who will be first to lose their virginity while at camp.,CM
2412,Malibu's Most Wanted,2003,5.2,"A senator arranges for his son, a rich white kid who fancies himself black, to be kidnapped by a couple of black actors pretending to be murderers to try and shock him out of his plans to become a rapper.",CM
2413,Babel,2006,7.5,"Tragedy strikes a married couple on vacation in the Moroccan desert, touching off an interlocking story involving four different families.",CM
2414,Alexander,2004,5.6,"Alexander, the King of Macedonia and one of the greatest army leaders in the history of warfare, conquers much of the known world.",CM
2415,This Is Where I Leave You,2014,6.6,"When their father passes away, four grown siblings are forced to return to their childhood home and live under the same roof together for a week, along with their over-sharing mother and an assortment of spouses, exes and might-have-beens.",CM
2416,Tommy,1975,6.6,"A psychosomatically deaf, dumb and blind boy becomes a master pinball player and, subsequently, the object of a religious cult.",CM
2417,The Hunted,2003,6.1,An FBI deep-woods tracker attempts to capture a trained assassin who has made a sport of hunting humans.,CM
2418,The Favourite,2018,7.7,"In early 18th century England, a frail Queen Anne occupies the throne and her close friend, Lady Sarah, governs the country in her stead. When a new servant, Abigail, arrives, her charm endears her to Sarah.",CM
2419,The Reader,2008,7.6,"Post-WWII Germany: Nearly a decade after his affair with an older woman came to a mysterious end, law student Michael Berg re-encounters his former lover as she defends herself in a war-crime trial.",CM
2420,The Best Man,1999,6.7,Just before best friend's wedding the life of Chicago writer becomes crazy when his friend guesses that new book's story based on his bride's fervent past.,CM
2421,My Dog Skip,2000,7.1,"A shy boy grows up in 1940s Mississippi with the help of his beloved dog, Skip.",CM
2422,Instinct,1999,6.6,"When a noted anthropologist who left society to live in the jungle is imprisoned for murder, it's up to a young psychiatrist to get through to him.",CM
2423,The Truth About Cats &amp; Dogs,1996,6.3,A successful veternarian &amp; radio show host with low self-esteem asks her model friend to impersonate her when a handsome man wants to see her.,CM
2424,Snakes on a Plane,2006,5.5,"An F.B.I. Agent takes on a plane full of deadly venomous snakes, deliberately released to kill a witness being flown from Honolulu to Los Angeles to testify against a mob boss.",CM
2425,The Duff,2015,6.5,"A high school senior instigates a social pecking order revolution after finding out that she has been labeled the DUFF - Designated Ugly Fat Friend - by her prettier, more popular counterparts.",CM
2426,Death Wish,2018,6.4,"Dr. Paul Kersey is an experienced trauma surgeon, a man who has spent his life saving lives. After an attack on his family, Paul embarks on his own mission for justice.",CM
2427,King Ralph,1991,5.2,"As the only relative to take over the Royal throne, a down on his luck American slob must learn the ways of the English.",CM
2428,"Everything, Everything",2017,6.4,A teenager who's spent her whole life confined to her home falls for the boy next door.,CM
2429,Closer,2004,7.3,The relationships of two couples become complicated and deceitful when the man from one couple meets the woman of the other.,CM
2430,Nice Dreams,1981,6.2,"Disguised as ice cream vendors, Cheech and Chong make--and subsequently lose--millions of dollars selling a batch of marijuana with an unusual side effect.",CM
2431,The Relic,1997,5.7,"A homicide detective and an anthropologist try to destroy a South American lizard-like god, who's on a people eating rampage in a Chicago museum.",CM
2432,Darkman,1990,6.4,A brilliant scientist left for dead returns to exact revenge on the people who burned him alive.,CM
2433,Mickey Blue Eyes,1999,5.8,"An English auctioneer proposes to the daughter of a Mafia kingpin, only to realize that certain ""favors"" would be asked of him.",CM
2434,All About Steve,2009,4.8,"Convinced that a CCN cameraman is her true love, an eccentric crossword puzzler trails him as he travels all over the country, hoping to convince him that they belong together.",CM
2435,The Pink Panther Strikes Again,1976,7.3,"Charles Dreyfus, who has finally cracked over inspector Clouseau's antics, escapes from a mental institution and launches an elaborate plan to get rid of Clouseau once and for all.",CM
2436,Stuck on You,2003,5.8,Conjoined twins from Martha's Vineyard move to Los Angeles so that one of them can pursue an acting career.,CM
2437,Wind River,2017,7.7,A veteran hunter helps an FBI agent investigate the murder of a young woman on a Wyoming Native American reservation.,CM
2438,Carrie,1976,7.4,"Carrie White, a shy, friendless teenage girl who is sheltered by her domineering, religious mother, unleashes her telekinetic powers after being humiliated by her classmates at her senior prom.",CM
2439,Where the Heart Is,2000,6.8,"A pregnant 17-year-old rebuilds her life after being abandoned by her boyfriend at a Wal-Mart in Sequoyah, Oklahoma.",CM
2440,Porky's II: The Next Day,1983,5.0,The naughty high schoolers of Angel Beach High now seek revenge on a group of KKK religious fanatics and corrupt politicians who want to shut down their Shakespeare production after they cast a Seminole transfer student in the lead.,CM
2441,Dreamcatcher,2003,5.5,Friends on a camping trip discover that the town they're vacationing in is being plagued in an unusual fashion by parasitic aliens from outer space.,CM
2442,Geostorm,2017,5.3,"When the network of satellites designed to control the global climate starts to attack Earth, it's a race against the clock for its creator to uncover the real threat before a worldwide Geostorm wipes out everything and everyone.",CM
2443,Curly Sue,1991,5.8,"A homeless man and his young companion, who survive by conning people, meet a woman who may need them even more than they need her.",CM
2444,Nell,1994,6.5,"In a remote woodland cabin, a small town doctor discovers Nell - a beautiful young hermit woman with many secrets.",CM
2445,The Punisher,2004,6.5,An undercover FBI agent becomes a vigilante assassin and sets out to unleash his wrath upon the corrupt businessman who slaughtered his entire family at a reunion.,CM
2446,Dying Young,1991,6.0,"After she discovers that her boyfriend has betrayed her, Hilary O'Neil is looking for a new start and a new job. She begins to work as a private nurse for a young man suffering from blood ... See full summary&nbsp;",CM
2447,Marmaduke,2010,4.2,"A suburban family moves to a new neighborhood with their large, yet lovable Great Dane, who has a tendency to wreak havoc in his own oblivious way.",CM
2448,The Gambler,2014,6.0,"Literature professor and gambler Jim Bennett's debt causes him to borrow money from his mother and a loan shark. Further complicating his situation, is his relationship with one of his students. Will Bennett risk his life for a second chance?",CM
2449,R.I.P.D.,2013,5.6,A recently slain cop joins a team of undead police officers working for the Rest in Peace Department and tries to find the man who murdered him.,CM
2450,Muppet Treasure Island,1996,7.0,The Muppets' twist on the classic tale.,CM
2451,Flags of our Fathers,2006,7.1,"The life stories of the six men who raised the flag at the Battle of Iwo Jima, a turning point in World War II.",CM
2452,The Turning Point,1977,6.9,"When her daughter joins a ballet company, a former dancer is forced to confront her long-ago decision to give up the stage to have a family.",CM
2453,Devil,2010,6.2,A group of people are trapped in an elevator and the Devil is mysteriously amongst them.,CM
2454,The Constant Gardener,2005,7.4,"A widower is determined to get to the bottom of a potentially explosive secret involving his wife's murder, big business, and corporate corruption.",CM
2455,The Spy Who Dumped Me,2018,6.0,Audrey and Morgan are best friends who unwittingly become entangled in an international conspiracy when one of the women discovers the boyfriend who dumped her was actually a spy.,CM
2456,I Spy,2002,5.4,A professional athlete has to help a U.S. government agent recover a missing jet.,CM
2457,Pay It Forward,2000,7.2,A young boy attempts to make the world a better place after his teacher gives him that chance.,CM
2458,Heroes,1977,6.1,A Vietnam veteran suffering from post traumatic stress disorder breaks out of a VA hospital and goes on a road trip with a sympathetic traveler to find out what became of the other men in his unit.,CM
2459,Semi-Pro,2008,5.8,"Jackie Moon, the owner-coach-player of the American Basketball Association's Flint Michigan Tropics, rallies his teammates to make their NBA dreams come true.",CM
2460,Fireproof,2008,6.6,"In an attempt to save his marriage, a firefighter uses a 40-day experiment known as ""The Love Dare.",CM
2461,Street Fighter,1994,3.9,Col. Guile and various other martial arts heroes fight against the tyranny of Dictator M. Bison and his cohorts.,CM
2462,Black Knight,2001,4.8,"Martin Lawrence plays Jamal, an employee in Medieval World amusement park. After sustaining a blow to the head, he awakens to find himself in 14th century England.",CM
2463,Doubt,2008,7.5,A Catholic school principal questions a priest's ambiguous relationship with a troubled young student.,CM
2464,Blue Jasmine,2013,7.3,"A New York socialite, deeply troubled and in denial, arrives in San Francisco to impose upon her sister. She looks a million, but isn't bringing money, peace, or love...",CM
2465,Planet of the Apes,1968,8.0,"An astronaut crew crash-lands on a planet in the distant future where intelligent talking apes are the dominant species, and humans are the oppressed and enslaved.",CM
2466,Halloween II,2009,4.9,"Laurie Strode struggles to come to terms with her brother Michael's deadly return to Haddonfield, Illinois; meanwhile, Michael prepares for another reunion with his sister.",CM
2467,Monster Trucks,2016,5.7,A young man working at a small town junkyard discovers and befriends a creature which feeds on oil being sought by a fracking company.,CM
2468,See Spot Run,2001,5.4,"A mailman takes care of a dog that, unbeknownst to him, is an FBI drug-sniffing superdog that has escaped from the witness protection program after becoming the target of an assassination.",CM
2469,The Long Kiss Goodnight,1996,6.8,A woman suffering from amnesia begins to recover her memories after trouble from her past finds her again.,CM
2470,The Informant!,2009,6.5,"The U.S. government decides to go after an agro-business giant with a price-fixing accusation, based on the evidence submitted by their star witness, vice president-turned-informant Mark Whitacre.",CM
2471,Woman in Gold,2015,7.3,"Maria Altmann, an octogenarian Jewish refugee, takes on the Austrian government to recover artwork she believes rightfully belongs to her family.",CM
2472,Mr. Bean's Holiday,2007,6.4,"Mr. Bean wins a trip to Cannes where he unwittingly separates a young boy from his father and must help the two come back together. On the way he discovers France, bicycling, and true love, among other things.",CM
2473,Child's Play,1988,6.6,"A single mother gives her son a much sought-after doll for his birthday, only to discover that it is possessed by the soul of a serial killer.",CM
2474,Grand Canyon,1991,6.9,The fates of several people are intertwining randomly. Their sympathy of each other faces multiple differences in their lifestyles.,CM
2475,Breach,2007,7.0,"FBI upstart Eric O'Neill enters into a power game with his boss, Robert Hanssen, an agent who was put on trial for selling secrets to the Soviet Union.",CM
2476,Amlie,2001,8.3,"Amlie is an innocent and naive girl in Paris with her own sense of justice. She decides to help those around her and, along the way, discovers love.",CM
2477,Silverado,1985,7.2,A misfit bunch of friends come together to right the injustices which exist in a small town.,CM
2478,Forget Paris,1995,6.4,"Mickey Gordon is a basketball referee who travels to France to bury his father. Ellen Andrews, an American living in Paris, works for the airline Mickey flies on. They meet and fall in love... See full summary&nbsp;",CM
2479,"Hello, Dolly!",1969,7.2,"Matchmaker Dolly Levi travels to Yonkers to find a partner for ""half-a-millionaire"" Horace Vandergelder, convincing his niece, his niece's intended, and his two clerks to travel to New York City along the way.",CM
2480,Striptease,1996,4.4,A stripper and single mother gets dragged into a dangerous situation after a congressman takes a fancy to her.,CM
2481,Teen Wolf,1985,6.0,An ordinary high school student discovers that his family has an unusual pedigree when he finds himself turning into a werewolf.,CM
2482,Matilda,1996,6.9,"Story of a wonderful little girl, who happens to be a genius, and her wonderful teacher vs. the worst parents ever and the worst school principal imaginable.",CM
2483,Zodiac,2007,7.7,"In the late 1960s/early 1970s, a San Francisco cartoonist becomes an amateur detective obsessed with tracking down the Zodiac Killer, an unidentified individual who terrorizes Northern California with a killing spree.",CM
2484,The Second Best Exotic Marigold Hotel,2015,6.6,As the Best Exotic Marigold Hotel has only a single remaining vacancy - posing a rooming predicament for two fresh arrivals - Sonny pursues his expansionist dream of opening a second hotel.,CM
2485,The Rite,2011,6.0,An American seminary student travels to Italy to take an exorcism course.,CM
2486,Arthur,2011,5.7,A drunken playboy stands to lose a wealthy inheritance when he falls for a woman his family doesn't like.,CM
2487,Daylight,1996,5.9,Disaster in a New York tunnel as explosions collapse both ends of it. One hero tries to help the people inside find their way to safety.,CM
2488,Dracula 2000,2000,4.9,"A group of thieves breaks into a chamber expecting to find paintings, but instead they release the count himself, who travels to New Orleans to find his nemesis' daughter, Mary Van Helsing.",CM
2489,TRON,1982,6.8,A computer hacker is abducted into the digital world and forced to participate in gladiatorial games where his only chance of escape is with the help of a heroic security program.,CM
2490,Friday After Next,2002,5.8,Two cousins work nights at a local mall as security guards. When their house is robbed on Christmas Eve they team up to track the robber down.,CM
2491,Friday the 13th: The Final Chapter,1984,6.0,"After being mortally wounded and taken to the morgue, murderer Jason Voorhees spontaneously revives and embarks on a killing spree as he makes his way back to his home at Camp Crystal Lake.",CM
2492,*batteries not included,1987,6.6,Apartment block tenants seek the aid of alien mechanical life-forms to save their building from demolition.,CM
2493,Mercury Rising,1998,6.1,Shadowy elements in the NSA target a nine-year old autistic savant for death when he is able to decipher a top secret code.,CM
2494,In Her Shoes,2005,6.5,"Strait-laced Rose breaks off relations with her party girl sister, Maggie, over an indiscretion involving Rose's boyfriend. The chilly atmosphere is broken with the arrival of Ella, the grandmother neither sister knew existed.",CM
2495,Bad News Bears,2005,5.8,A grizzled little league coach tries to turn his team of misfits into champs.,CM
